PROCESO,TRAMITE,ID_CLASE,CEDULA,NOMBRE_COMPLETO,USUARIO,Totales,Año,Mes,Día
Emisión de Licencia por Primera Vez,81614233,B,1721860524,CABRERA CRUZ MAURICIO GEOVANNY,JPROJAS,1,2024,julio,26
Renovación de Licencia,79291234,B,1713100855,BOLAÑOS ORTEGA  MARIA FANY,JPROJAS,1,2024,julio,26
Renovación de Licencia,81694407,B,1719362830,DAVILA OSPINA DIANA PATRICIA,JPROJAS,1,2024,julio,26
Renovación de Licencia,81945047,B,1716636889,PAZMIÑO PAREDES IBETH ALEXANDRA,JPROJAS,1,2024,julio,26
Renovación de Licencia,81988653,B,1702427947,ZELENKO ZLOCH ROSEMARIE,JPROJAS,1,2024,julio,26
Renovación de Licencia,82111281,B,1303884066,CANCHINGRE CAMPOS RAMON AURELIO,JPROJAS,1,2024,julio,26
Renovación de Licencia,80514506,E,0502014921,PEREZ GUTIERREZ JUAN CARLOS,JPROJAS,1,2024,julio,26
Renovación de Licencia,82182389,E,1710421510,CATAGNIA LUIS CESAR,JPROJAS,1,2024,julio,26
